"category","rank","titles","prices"
"Politics Social Sciences",64,"The New Jim Crow:  Mass Incarceration in the Age of Colorblindness","$13.56"
"Politics Social Sciences",65,"Extremely Loud and Incredibly Close: A Novel","$9.99"
"Politics Social Sciences",66,"Meditations (Dover Thrift Editions)","$1.78"
"Politics Social Sciences",67,"Slouching Towards Bethlehem: Essays","$1.99"
"Politics Social Sciences",68,"The Devil in the White City","$0.00 with Trial"
"Politics Social Sciences",69,"Lean In: Women, Work, and the Will to Lead","$7.01"
"Politics Social Sciences",70,"The Art Of War","$4.99"
"Politics Social Sciences",71,"When Breath Becomes Air","$17.50"
"Politics Social Sciences",72,"The Life-Changing Magic of Tidying Up: The Japanese Art of Decluttering and Organizing","$0.00 with Trial"
"Politics Social Sciences",73,"From Here to Eternity: Traveling the World to Find the Good Death","$16.23"
"Politics Social Sciences",74,"Nudge: Improving Decisions About Health, Wealth, and Happiness","$13.99"
"Politics Social Sciences",75,"Between the World and Me","$0.00 with Trial"
"Politics Social Sciences",76,"Mayo Clinic Guide to a Healthy Pregnancy (Bestsellers)","$10.73"
"Politics Social Sciences",77,"Billionaire at the Barricades: The Populist Revolution from Reagan to Trump","$14.99"
"Politics Social Sciences",78,"Homo Deus: A Brief History of Tomorrow","$0.00 with Trial"
"Politics Social Sciences",79,"The Four: The Hidden DNA of Amazon, Apple, Facebook, and Google","$0.00 with Trial"
"Politics Social Sciences",80,"Outliers: The Story of Success","$13.49"
"Politics Social Sciences",81,"Dreamland: The True Tale of America's Opiate Epidemic","$12.87"
"Politics Social Sciences",82,"Scalia Speaks: Reflections on Law, Faith, and Life Well Lived","$22.35"
"Politics Social Sciences",83,"How to Think: A Survival Guide for a World at Odds","$15.31"
"Politics Social Sciences",84,"Fantasyland: How America Went Haywire: A 500-Year History","$0.00 with Trial"
"Politics Social Sciences",85,"Mad City: The True Story of the Campus Murders That America Forgot","$4.99"
"Politics Social Sciences",86,"Fatwa: Hunted in America","$19.51"
"Politics Social Sciences",87,"Of Mess and Moxie: Wrangling Delight out of This Wild and Glorious Life","$0.00 with Trial"
"Politics Social Sciences",88,"Clinton Cash: The Untold Story of How and Why Foreign Governments and Businesses Helped Make Bill and Hillary Rich","$9.60"
"Politics Social Sciences",89,"Washington: The Indispensable Man","$1.99"
"Politics Social Sciences",90,"Why Buddhism is True: The Science and Philosophy of Meditation and Enlightenment","$18.36"
"Politics Social Sciences",91,"Men We Reaped: A Memoir","$1.99"
"Politics Social Sciences",92,"Emergency: This Book Will Save Your Life","$10.33"
"Politics Social Sciences",93,"Trump is F*cking Crazy: (This is Not a Joke)","$17.70"
"Politics Social Sciences",94,"Code Girls: The Untold Story of the American Women Code Breakers of World War II","$16.80"
"Politics Social Sciences",95,"When Breath Becomes Air","$12.99"
"Politics Social Sciences",96,"The Big Lie: Exposing the Nazi Roots of the American Left","$20.39"
"Politics Social Sciences",97,"Dangerous","$0.00 with Trial"
"Politics Social Sciences",98,"Farewell: The Greatest Spy Story of the Twentieth Century","$1.99"
"Politics Social Sciences",99,"The Storm Before the Storm: The Beginning of the End of the Roman Republic","$17.70"
"Politics Social Sciences",100,"Billionaire at the Barricades: The Populist Revolution from Reagan to Trump","$0.00 with Trial"
"Reference",1,"Orphan Train: A Novel","$2.99"
"Reference",2,"Wonder","$10.51"
"Reference",3,"A Gentleman in Moscow: A Novel","$13.99"
"Reference",4,"Giraffes Can't Dance","$5.39"
"Reference",5,"The Power of Habit: Why We Do What We Do in Life and Business","$0.00 with Trial"
"Reference",6,"The Very Hungry Caterpillar","$6.89"
"Reference",7,"The Official SAT Study Guide, 2018 Edition (Official Study Guide for the New Sat)","$20.78"
"Reference",8,"The Professor and the Madman: A Tale of Murder, Insanity, and the Making of the Oxford English Dictionary","$1.99"
"Reference",9,"The Wonderful Things You Will Be","$12.90"
"Reference",10,"How to Work From Home and Make Money in 2017: 13 Proven Home-Based Businesses You Can Start Today (Work from Home Series: Book 1)","$2.99"
"Reference",11,"A Gentleman in Moscow: A Novel","$17.41"
"Reference",12,"Player's Handbook (Dungeons & Dragons)","$29.97"
"Reference",13,"A Gentleman in Moscow: A Novel","$0.00 with Trial"
"Reference",14,"Mindset: The New Psychology of Success","$10.20"
"Reference",15,"Wonder","$0.00 with Trial"
"Reference",16,"Publication Manual of the American Psychological Association","$19.00"
"Reference",17,"The Pout-Pout Fish","$4.99"
"Reference",18,"The Body Keeps the Score: Brain, Mind, and Body in the Healing of Trauma","$12.83"
"Reference",19,"Thinking, Fast and Slow","$9.60"
"Reference",20,"Wonder","$9.99"
"Reference",21,"Where Is Baby's Belly Button? A Lift-the-Flap Book","$4.35"
"Reference",22,"The Sense of Style: The Thinking Person's Guide to Writing in the 21st Century","$1.99"
"Reference",23,"Fahrenheit 451","$13.34"
"Reference",24,"The Glass Castle: A Memoir","$10.29"
"Reference",25,"Small Great Things: A Novel","$14.99"
"Reference",26,"The Power of Now","$0.00 with Trial"
"Reference",27,"The Power of Now: A Guide to Spiritual Enlightenment","$8.98"
"Reference",28,"The Alchemist","$13.05"
"Reference",29,"The Golden Compass: His Dark Materials, Book 1","$0.00 with Trial"
"Reference",30,"The Giving Tree","$11.39"
"Reference",31,"Dungeon Master's Guide (D&D Core Rulebook)","$32.41"
"Reference",32,"The Official ACT Prep Guide, 2018: Official Practice Tests + 400 Bonus Questions Online","$27.96"
"Reference",33,"The Big Book of Serial Killers: 150 Serial Killer Files of the World's Worst Murderers (An Encyclopedia of Serial Killers)","$1.60"
"Reference",34,"Guess How Much I Love You","$4.99"
"Reference",35,"Grit: The Power of Passion and Perseverance","$0.00 with Trial"
"Reference",36,"Monster Manual (D&D Core Rulebook)","$34.09"
"Reference",37,"The Book with No Pictures","$15.19"
"Reference",38,"Lord of the Flies","$6.79"
"Reference",39,"How to Talk So Kids Will Listen & Listen So Kids Will Talk","$9.56"
"Reference",40,"Harry Potter - A Journey Through A History of Magic","$8.99"
"Reference",41,"The Power of Habit: Why We Do What We Do in Life and Business","$10.56"
"Reference",42,"The Graveyard Book: Full-Cast Production","$0.00 with Trial"
"Reference",43,"Phonics for Kindergarten, Grade K (Home Workbook)","$4.49"
"Reference",44,"Hatchet","$5.99"
"Reference",45,"Grit: The Power of Passion and Perseverance","$19.17"
"Reference",46,"Cracking the Coding Interview: 189 Programming Questions and Solutions","$37.95"
"Reference",47,"Saunders Comprehensive Review for the NCLEX-RN® Examination, 7e (Saunders Comprehensive Review for Nclex-Rn)","$51.63"
"Reference",48,"Guinness World Records 2018: Meet our Real-Life Superheroes","$14.97"
"Reference",49,"The Day the Crayons Quit","$13.39"
"Reference",50,"Mark Bittman's Kitchen Matrix: More Than 700 Simple Recipes and Techniques to Mix and Match for Endless Possibilities","$2.99"
"Reference",51,"Little Blue Truck board book","$7.18"
"Reference",52,"The Magnolia Story","$13.49"
"Reference",53,"The 4-Hour Workweek: Escape 9-5, Live Anywhere, and Join the New Rich (Expanded and Updated)","$0.00 with Trial"
"Reference",54,"The Glass Castle: A Memoir","$0.00 with Trial"
"Reference",55,"Rand McNally Signature Map of the World, 50 x 32-Inch","$4.89"
"Reference",56,"5 lb. Book of GRE Practice Problems (Manhattan Prep GRE Strategy Guides)","$21.01"
"Reference",57,"A Brief History of Everyone Who Ever Lived: The Human Story Retold Through Our Genes","$9.99"
"Reference",58,"Sticky Fingers: The Life and Times of Jann Wenner and Rolling Stone Magazine","$19.46"
"Reference",59,"Teach Your Child to Read in 100 Easy Lessons","$15.19"
"Reference",60,"The Art of Racing in the Rain: A Novel","$1.99"
"Reference",61,"Lots and Lots of Letter Tracing Practice!","$6.78"
"Reference",62,"The One and Only Ivan","$6.79"
"Reference",63,"Animal farm: A Fairy Story","$8.87"
"Reference",64,"Just Mercy: A Story of Justice and Redemption","$12.00"
"Reference",65,"The 4-Hour Workweek: Escape 9-5, Live Anywhere, and Join the New Rich","$15.31"
"Reference",66,"Never Let Me Go","$10.87"
"Reference",67,"Mating in Captivity: Reconciling the Erotic & the Domestic","$0.00 with Trial"
"Reference",68,"A Brief History of Everyone Who Ever Lived: The Human Story Retold Through Our Genes","$17.64"
"Reference",69,"Time to Be in Earnest","$1.99"
"Reference",70,"The Elements of Style, Fourth Edition","$5.82"
"Reference",71,"Modern Romance: An Investigation","$0.00 with Trial"
"Reference",72,"The Legend of Zelda Encyclopedia","$23.99"
"Reference",73,"A Long Walk to Water: Based on a True Story","$7.19"
"Reference",74,"The New Jim Crow:  Mass Incarceration in the Age of Colorblindness","$13.56"
"Reference",75,"The Seven Principles for Making Marriage Work: A Practical Guide from the Country's Foremost Relationship Expert","$9.29"
"Reference",76,"The ONE Thing: The Surprisingly Simple Truth Behind Extraordinary Results","$14.01"
"Reference",77,"The Story of Ferdinand","$4.99"
"Reference",78,"My Mouth Is a Volcano!","$9.92"
"Reference",79,"The Knot Ultimate Wedding Planner & Organizer [binder edition]: Worksheets, Checklists, Etiquette, Calendars, and Answers to Frequently Asked Questions","$23.59"
"Reference",80,"15 Minutes to a Better Interview: What I Wish EVERY Job Candidate Knew","$4.99"
"Reference",81,"We Are in a Book! (An Elephant and Piggie Book)","$5.89"
"Reference",82,"National Geographic Little Kids First Big Book of Dinosaurs (National Geographic Little Kids First Big Books)","$8.59"
"Reference",83,"ATI TEAS Secrets Study Guide: TEAS 6 Complete Study Manual, Full-Length Practice Tests, Review Video Tutorials for the Test of Essential Academic Skills, Sixth Edition","$33.92"
"Reference",84,"The Snail and the Whale","$6.99"
"Reference",85,"GRE Prep Plus 2018: Practice Tests + Proven Strategies + Online + Video + Mobile (Kaplan Test Prep)","$27.19"
"Reference",86,"The Shack: Where Tragedy Confronts Eternity","$8.81"
"Reference",87,"The Exalted Dragons Complete Series Box-Set: (Books 1 to 4)","$0.99"
"Reference",88,"Job Free: Four Ways to Quit the Rat Race and Achieve Financial Freedom on Your Terms","$3.99"
"Reference",89,"Hamlet ( Folger Library Shakespeare)","$5.39"
"Reference",90,"A Guide to the Project Management Body of Knowledge (PMBOK® Guide)<U+0096>Fifth Edition","$44.84"
"Reference",91,"Scalia Speaks: Reflections on Law, Faith, and Life Well Lived","$22.35"
"Reference",92,"Where the Past Begins: A Writer's Memoir","$17.39"
"Reference",93,"The Happiest Baby on the Block; Fully Revised and Updated Second Edition: The New Way to Calm Crying and Help Your Newborn Baby Sleep Longer","$12.70"
"Reference",94,"Proof of Heaven: A Neurosurgeon's Journey into the Afterlife","$9.59"
"Reference",95,"Diary of a Wimpy Kid, Book 1","$8.79"
"Reference",96,"Gulp: Adventures on the Alimentary Canal","$9.99"
"Reference",97,"First Little Readers Parent Pack: Guided Reading Level A: 25 Irresistible Books That Are Just the Right Level for Beginning Readers","$16.19"
"Reference",98,"Cracking the ACT with 6 Practice Tests, 2017 Edition: The Techniques, Practice, and Review You Need to Score Higher (College Test Preparation)","$13.59"
"Reference",99,"2018 Rand McNally Large Scale Road Atlas (Rand McNally Large Scale Road Atlas U. S. A.)","$17.32"
"Reference",100,"Moleskine Classic Notebook, Large, Ruled, Black, Hard Cover (5 x 8.25) (Classic Notebooks)","$15.43"
"Religion Spirituality",1,"The Wisdom of Sundays: Life-Changing Insights from Super Soul Conversations","$16.79"
"Religion Spirituality",2,"From Sand and Ash","$4.99"
"Religion Spirituality",3,"The Hideaway","$1.99"
"Religion Spirituality",4,"Braving the Wilderness: The Quest for True Belonging and the Courage to Stand Alone","$0.00 with Trial"
"Religion Spirituality",5,"The Code of the Extraordinary Mind: 10 Unconventional Laws to Redefine Your Life and Succeed On Your Own Terms","$9.99"
"Religion Spirituality",6,"Milk and Honey","$8.99"
"Religion Spirituality",7,"The 5 Love Languages: The Secret to Love that Lasts","$9.59"
"Religion Spirituality",8,"God Longs to Heal You: Free Your Body, Mind, and Spirit","$0.99"
"Religion Spirituality",9,"Anxious for Nothing: Finding Calm in a Chaotic World","$15.47"
"Religion Spirituality",10,"Boat of Stone: A Novel","$7.99"
"Religion Spirituality",11,"Braving the Wilderness: The Quest for True Belonging and the Courage to Stand Alone","$16.37"
"Religion Spirituality",12,"The Four Agreements: A Practical Guide to Personal Freedom (A Toltec Wisdom Book)","$7.42"
"Religion Spirituality",13,"Same Kind of Different As Me: A Modern-Day Slave, an International Art Dealer, and the Unlikely Woman Who Bound Them Together","$9.99"
"Religion Spirituality",14,"The Wisdom of Sundays: Life-Changing Insights from Super Soul Conversations","$0.00 with Trial"
"Religion Spirituality",15,"Mail Order Bride: A Judge's Wife (Mail Order Montana) (A Western Romance Book)","$0.99"
"Religion Spirituality",16,"Those Who Save Us","$9.99"
"Religion Spirituality",17,"The Wisdom of Sundays: Life-Changing Insights from Super Soul Conversations","$14.99"
"Religion Spirituality",18,"Judgment Detox: Release the Beliefs That Hold You Back from Living A Better Life","$17.86"
"Religion Spirituality",19,"Dash For Cash: A Garden Girls Cozy Mystery (Garden Girls Christian Cozy Mystery Series Book 18)","$0.99"
"Religion Spirituality",20,"Love Wins: A Book About Heaven, Hell, and the Fate of Every Person Who Ever Lived","$1.99"
"Religion Spirituality",21,"Judgment Detox: Release the Beliefs That Hold You Back from Living A Better Life","$13.99"
"Religion Spirituality",22,"The Wiersbe Bible Study Series: Revelation: In Christ You Are an Overcomer","$2.39"
"Religion Spirituality",23,"The Little Book of Hygge: Danish Secrets to Happy Living","$1.99"
"Religion Spirituality",24,"The Life-Changing Magic of Tidying Up: The Japanese Art of Decluttering and Organizing","$9.79"
"Religion Spirituality",25,"The God Delusion","$10.99"
"Religion Spirituality",26,"The Mountain Between Us","$9.99"
"Religion Spirituality",27,"Martin Luther: The Man Who Rediscovered God and Changed the World","$18.00"
"Religion Spirituality",28,"Lessons from the Light: What We Can Learn from the Near-Death Experience","$0.99"
"Religion Spirituality",29,"Killing Kryptonite: Destroy What Steals Your Strength","$12.42"
"Religion Spirituality",30,"Knocked Up and Tied Down","$0.99"
"Religion Spirituality",31,"Jesus Calling: Enjoying Peace in His Presence","$9.79"
"Religion Spirituality",32,"Same Kind of Different as Me: A Modern-Day Slave, an International Art Dealer, and the Unlikely Woman Who Bound Them Together","$0.00 with Trial"
"Religion Spirituality",33,"The Dark Tower: And Other Stories","$1.99"
"Religion Spirituality",34,"Same Kind of Different As Me: A Modern-Day Slave, an International Art Dealer, and the Unlikely Woman Who Bound Them Together","$14.44"
"Religion Spirituality",35,"The Paradigm: The Ancient Blueprint That Holds the Mystery of Our Times","$13.19"
"Religion Spirituality",36,"Hand Me Down Husband","$1.99"
"Religion Spirituality",37,"The Alchemist: A Fable About Following Your Dream","$0.00 with Trial"
"Religion Spirituality",38,"The Untethered Soul: The Journey Beyond Yourself","$11.99"
"Religion Spirituality",39,"Threading My Prayer Rug: One Woman's Journey from Pakistani Muslim to American Muslim","$1.99"
"Religion Spirituality",40,"The Five Love Languages: The Secret to Love That Lasts","$0.00 with Trial"
"Religion Spirituality",41,"Medical Medium Thyroid Healing: The Truth behind Hashimoto's, Graves', Insomnia, Hypothyroidism, Thyroid Nodules & Epstein-Barr","$16.79"
"Religion Spirituality",42,"Buying the Farm","$0.99"
"Religion Spirituality",43,"Prayer: Experiencing Awe and Intimacy with God","$1.99"
"Religion Spirituality",44,"Braving the Wilderness: The Quest for True Belonging and the Courage to Stand Alone","$14.99"
"Religion Spirituality",45,"The Hollywood Commandments: A Spiritual Guide to Secular Success","$17.10"
"Religion Spirituality",46,"The Power of Now","$0.00 with Trial"
"Religion Spirituality",47,"The Power of Now: A Guide to Spiritual Enlightenment","$8.98"
"Religion Spirituality",48,"The Underground Girls of Kabul: In Search of a Hidden Resistance in Afghanistan","$1.99"
"Religion Spirituality",49,"The Alchemist","$13.05"
"Religion Spirituality",50,"Lessons From a Third Grade Dropout","$8.02"
"Religion Spirituality",51,"The Untethered Soul: The Journey Beyond Yourself","$0.00 with Trial"
"Religion Spirituality",52,"Why Buddhism Is True: The Science and Philosophy of Enlightenment","$0.00 with Trial"
"Religion Spirituality",53,"Daring Greatly: How the Courage to Be Vulnerable Transforms the Way We Live, Love, Parent, and Lead","$10.26"
"Religion Spirituality",54,"31 Inspirational Christmas Romances: Sweet Christmas Romance Box Set","$0.99"
"Religion Spirituality",55,"Night (Night)","$6.47"
"Religion Spirituality",56,"The 5 Love Languages: The Secret to Love that Lasts","$6.67"
"Religion Spirituality",57,"AARP Meditations for Caregivers: Practical, Emotional, and Spiritual Support for You and Your Family","$10.87"
"Religion Spirituality",58,"To Be Where You Are (A Mitford Novel)","$12.99"
"Religion Spirituality",59,"Man's Search for Meaning","$9.97"
"Religion Spirituality",60,"Storm Clouds Rolling In (#1 in the Bregdan Chronicles Historical Fiction Romance Series)","$0.99"
"Religion Spirituality",61,"An Autumn Stroll: An Inspirational Romance","$0.99"
"Religion Spirituality",62,"Lessons From a Third Grade Dropout","$4.99"
"Religion Spirituality",63,"Tears of the Silenced: A True Crime and an American Tragedy; Severe Child Abuse and Leaving the Amish","$2.99"
"Religion Spirituality",64,"NIV, Promises for Women, eBook (Promises for ...)","$0.99"
"Religion Spirituality",65,"Boundaries Updated and Expanded Edition: When to Say Yes, How to Say No To Take Control of Your Life","$13.35"
"Religion Spirituality",66,"Anxious for Nothing: Finding Calm in a Chaotic World","$9.99"
"Religion Spirituality",67,"Uninvited: Living Loved When You Feel Less Than, Left Out, and Lonely","$11.06"
"Religion Spirituality",68,"The Four Agreements","$0.00 with Trial"
"Religion Spirituality",69,"Crystal Muse: Everyday Rituals to Tune In to the Real You","$20.73"
"Religion Spirituality",70,"The Book of Joy: Lasting Happiness in a Changing World","$17.82"
"Religion Spirituality",71,"The Fearless Groom (Texas Titan Romances)","$2.99"
"Religion Spirituality",72,"The Secret","$0.00 with Trial"
"Religion Spirituality",73,"BOSTON HOMICIDE (Clean Suspense) (The City Murders Book 1)","$2.99"
"Religion Spirituality",74,"Adult Coloring Book: Stress Relieving Animal Designs","$5.99"
"Religion Spirituality",75,"The Magnolia Story","$13.49"
"Religion Spirituality",76,"Anxious for Nothing: Finding Calm in a Chaotic World","$0.00 with Trial"
"Religion Spirituality",77,"Meditation: Meditation for Beginners - How to Relieve Stress, Anxiety and Depression and Return to a State of Inner Peace and Happiness (How to Meditate, ... for Beginners, Mindfulness Book 1)","$2.99"
"Religion Spirituality",78,"The Miracle Morning: The Not-So-Obvious Secret Guaranteed to Transform Your Life (Before 8AM)","$9.97"
"Religion Spirituality",79,"To Be Where You Are (A Mitford Novel)","$18.28"
"Religion Spirituality",80,"Soar!: Build Your Vision from the Ground Up","$14.99"
"Religion Spirituality",81,"Why Me?","$0.99"
"Religion Spirituality",82,"The Jesus Storybook Bible: Every Story Whispers His Name","$13.59"
"Religion Spirituality",83,"J.R.R. Tolkien: A Life Inspired","$2.99"
"Religion Spirituality",84,"The Book of Joy: Lasting Happiness in a Changing World","$0.00 with Trial"
"Religion Spirituality",85,"Wonderland Wishes: 7 Never-Before-Released Christian Christmas Romances","$0.99"
"Religion Spirituality",86,"The Case for Jesus: The Biblical and Historical Evidence for Christ","$1.99"
"Religion Spirituality",87,"Indescribable: 100 Devotions for Kids About God and Science","$11.72"
"Religion Spirituality",88,"The Daniel Dilemma: How to Stand Firm and Love Well in a Culture of Compromise","$10.72"
"Religion Spirituality",89,"Medical Medium: Secrets Behind Chronic and Mystery Illness and How to Finally Heal","$18.35"
"Religion Spirituality",90,"God Bless You and Good Night (A God Bless Book)","$6.89"
"Religion Spirituality",91,"The Rabbi","$1.99"
"Religion Spirituality",92,"Codependent No More: How to Stop Controlling Others and Start Caring for Yourself","$13.39"
"Religion Spirituality",93,"Beyond Belief: My Secret Life Inside Scientology and My Harrowing Escape","$1.99"
"Religion Spirituality",94,"Anxious for Nothing Study Guide: Finding Calm in a Chaotic World","$9.89"
"Religion Spirituality",95,"Soar!: Build Your Vision from the Ground Up","$0.00 with Trial"
"Religion Spirituality",96,"Martin Luther: The Man Who Rediscovered God and Changed the World","$0.00 with Trial"
"Religion Spirituality",97,"The Armor of God","$12.99"
"Religion Spirituality",98,"So Happy Together (Bishop Family Book 4)","$0.99"
"Religion Spirituality",99,"Daring Greatly: How the Courage to Be Vulnerable Transforms the Way We Live, Love, Parent, and Lead","$0.00 with Trial"
"Religion Spirituality",100,"Breaking the Habit of Being Yourself: How to Lose Your Mind and Create a New One","$0.00 with Trial"
"Romance",1,"The Surprise","$0.99"
"Romance",2,"Beautiful Ruins: A Novel","$2.99"
"Romance",3,"The Girl With No Name","$6.62"
"Romance",4,"A Dark Lure","$4.99"
"Romance",5,"From Sand and Ash","$4.99"
"Romance",6,"Sweet Tea Tuesdays","$0.99"
"Romance",7,"A Shade of Vampire 51: A Call of Vampires","$3.99"
"Romance",8,"The Five Brothers Next Door: A Reverse Harem Romance","$0.99"
"Romance",9,"Dirty Rich One Night Stand: a sexy standalone novel","$3.99"
"Romance",10,"Knocked Up by the Master: A BDSM Secret Baby Romance","$0.99"
"Romance",11,"The Hideaway","$1.99"
"Romance",12,"The Strawberry Hearts Diner","$1.99"
"Romance",13,"Everything We Left Behind: A Novel","$1.99"
"Romance",14,"Lauren's Barbarian: A SciFi Alien Romance (Icehome Book 1)","$3.99"
"Romance",15,"Tourmaline (Awakened Sea Dragons Book 2)","$0.99"
"Romance",16,"Daddy To Be: A Billionaire's Baby Romance","$0.99"
"Romance",17,"On a Tuesday","$2.99"
"Romance",18,"Forbidden Love Series Book 1: Out Of The Dark","$0.99"
"Romance",19,"Fool Me Once (First Wives Series Book 1)","$4.99"
"Romance",20,"Fairytale: A Novel","$14.99"
"Romance",21,"His Little Bad Girl (Innocence Claimed)","$0.99"
"Romance",22,"Tempting","$0.99"
"Romance",23,"The Chocolatier's Wife","$0.99"
"Romance",24,"The Perfect Gift: A Bad Boy Christmas Romance","$0.99"
"Romance",25,"Meant To Be (Fated Loves Book 2)","$0.99"
"Romance",26,"Tempting Daddy's Boss (Innocence Claimed)","$0.99"
"Romance",27,"Vicious (Sinners of Saint)","$3.99"
"Romance",28,"Unfriended: A Geek and Stud Romance (Love in New Highland Book 1)","$0.99"
"Romance",29,"Everything We Keep: A Novel","$4.99"
"Romance",30,"The Woodcutter's Wife","$0.99"
"Romance",31,"Milk and Honey","$8.99"
"Romance",32,"Magnolia Nights","$2.99"
"Romance",33,"Abducted (Lizzy Gardner Series, Book 1)","$0.99"
"Romance",34,"Quadruplets for the Billionaire (Babies for the Billionaire Book 2)","$0.99"
"Romance",35,"Darker: Fifty Shades Darker as Told by Christian (Fifty Shades of Grey Series)","$9.99"
"Romance",36,"Her Last Goodbye (Morgan Dane Book 2)","$4.99"
"Romance",37,"Maverick","$3.99"
"Romance",38,"Foreplay: A Bad Boy's Baby Romance","$0.99"
"Romance",39,"Scandalous (Sinners of Saint Book 4)","$3.99"
"Romance",40,"Miss Frazer's Adventure","$1.99"
"Romance",41,"Knocked Up by the Dom: A BDSM Secret Baby Romance","$0.99"
"Romance",42,"No Limits: A Billionaire Bad Boy Romance","$0.99"
"Romance",43,"A Beauty for the Scarred Duke: A Historical Regency Romance Book","$0.99"
"Romance",44,"Burn for You (Slow Burn Book 1)","$4.99"
"Romance",45,"Ruthless King (The Anti-Heroes Collection Book 1)","$3.99"
"Romance",46,"Hot Sugar:  A Billionaire Bad Boy Romance","$0.99"
"Romance",47,"36 Inches: A MFMM Romantic Comedy","$0.99"
"Romance",48,"Summer Camp Captive","$0.99"
"Romance",49,"A Shade of Vampire (New & Lengthened 2015 Edition)","$0.99"
"Romance",50,"The Billionaire's Toy","$0.99"
"Romance",51,"Unintended: A Sin Series Standalone Novel (The Sin Trilogy Book 5)","$3.99"
"Romance",52,"Bromosexual","$0.99"
"Romance",53,"Show Me the Way: A Fight for Me Stand-Alone Novel","$3.99"
"Romance",54,"Matchmaker","$0.99"
"Romance",55,"Wrong Number, Right Guy","$0.99"
"Romance",56,"Drive","$2.99"
"Romance",57,"Caged","$3.99"
"Romance",58,"Say You're Sorry (Morgan Dane Book 1)","$4.99"
"Romance",59,"The Devil's Lady","$0.99"
"Romance",60,"The Last Move","$3.99"
"Romance",61,"Joyfully His: A Novella (Sterling Canyon Book 4)","$2.99"
"Romance",62,"The Secret Wife: A captivating story of romance, passion and mystery","$0.99"
"Romance",63,"Played: A Novel (Gridiron Series Book 4)","$0.99"
"Romance",64,"Club Desire: The Complete Series Box Set","$0.99"
"Romance",65,"The Hundredth Queen (The Hundredth Queen Series Book 1)","$4.99"
"Romance",66,"Knight Games Omnibus: Books 1-4","$0.99"
"Romance",67,"The Designer","$4.99"
"Romance",68,"Covert Evidence (Evidence Series Book 5)","$0.99"
"Romance",69,"Accidentally Hers (Sterling Canyon Book 1)","$0.99"
"Romance",70,"Friendly Fire (The Echo Platoon Series)","$0.99"
"Romance",71,"Don't Stand So Close: A Brother's Best Friend Romance","$0.99"
"Romance",72,"Zach (Destiny in Deadwood Book 3)","$0.99"
"Romance",73,"The Gender Game","$3.99"
"Romance",74,"Hate To Love You","$2.99"
"Romance",75,"Running Into Love (Fluke My Life Book 1)","$3.99"
"Romance",76,"Black Roses (A Mitchell Sisters Novel)","$3.99"
