"category","rank","titles","prices"
"Health Fitness Dieting",95,"Teach Your Child to Read in 100 Easy Lessons","$15.19"
"Health Fitness Dieting",96,"Tiny Beautiful Things: Advice on Love and Life from Dear Sugar","$9.19"
"Health Fitness Dieting",97,"The Dangerous Case of Donald Trump: 27 Psychiatrists and Mental Health Experts Assess a President","$0.00 with Trial"
"Health Fitness Dieting",98,"The Fast Metabolism Diet: Eat More Food and Lose More Weight","$14.87"
"Health Fitness Dieting",99,"The Book of Joy: Lasting Happiness in a Changing World","$0.00 with Trial"
"Health Fitness Dieting",100,"The Obesity Code: Unlocking the Secrets of Weight Loss","$0.00 with Trial"
"History",1,"The Death of the Banker: The Decline and Fall of the Great Financial Dynasties and the Triumph of the Small Investor","$0.00 with Trial"
"History",2,"What Happened","$0.00 with Trial"
"History",3,"Grant","$23.99"
"History",4,"The Intimate Life of Alexander Hamilton","$1.99"
"History",5,"What Happened","$17.99"
"History",6,"Mary's Mosaic: The CIA Conspiracy to Murder John F. Kennedy, Mary Pinchot Meyer, and Their Vision for World Peace: Third Edition","$1.99"
"History",7,"Killing England: The Brutal Struggle for American Independence (Bill O'Reilly's Killing Series)","$14.99"
"History",8,"Killing England: The Brutal Struggle for American Independence (Bill O'Reilly's Killing Series)","$17.95"
"History",9,"Grant","$0.00 with Trial"
"History",10,"Grant","$19.99"
"History",11,"In Harm's Way: The Sinking of the U.S.S. Indianapolis and the Extraordinary Story of Its Survivors","$9.99"
"History",12,"Sapiens: A Brief History of Humankind","$0.00 with Trial"
"History",13,"Extreme Ownership: How U.S. Navy SEALs Lead and Win","$0.00 with Trial"
"History",14,"The Pilgrims","$1.99"
"History",15,"What Happened","$14.99"
"History",16,"Martin Luther: The Man Who Rediscovered God and Changed the World","$18.00"
"History",17,"Killing England: The Brutal Struggle for American Independence","$0.00 with Trial"
"History",18,"Napoleon: A Life","$1.99"
"History",19,"The Winter Fortress: The Epic Mission to Sabotage Hitler's Atomic Bomb","$9.99"
"History",20,"The Second World Wars: How the First Global Conflict Was Fought and Won","$24.00"
"History",21,"Sapiens: A Brief History of Humankind","$21.00"
"History",22,"Extreme Ownership: How U.S. Navy SEALs Lead and Win","$18.35"
"History",23,"Night (Night)","$6.47"
"History",24,"Ben Franklin: The American Dream (The True Story of Benjamin Franklin) (Historical Biographies of Famous People)","$2.99"
"History",25,"Man's Search for Meaning","$9.97"
"History",26,"Sapiens: A Brief History of Humankind","$16.99"
"History",27,"Unbelievable: My Front-Row Seat to the Craziest Campaign in American History","$17.68"
"History",28,"Unbelievable: My Front-Row Seat to the Craziest Campaign in American History","$12.99"
"History",29,"The Butchering Art: Joseph Lister's Quest to Transform the Grisly World of Victorian Medicine","$16.50"
"History",30,"Nine Years Among the Indians, 1870-1879: The Story of the Captivity and Life of a Texan Among the Indians","$0.99"
"History",31,"Alexander the Great","$1.99"
"History",32,"D DAY Through German Eyes - The Hidden Story of June 6th 1944","$2.99"
"History",33,"Killers of the Flower Moon: The Osage Murders and the Birth of the FBI","$14.99"
"History",34,"Sticky Fingers: The Life and Times of Jann Wenner and Rolling Stone Magazine","$19.46"
"History",35,"Unbelievable: My Front-Row Seat to the Craziest Campaign in American History","$0.00 with Trial"
"History",36,"Liar, Temptress, Soldier, Spy: Four Women Undercover in the Civil War","$1.99"
"History",37,"On Tyranny: Twenty Lessons from the Twentieth Century","$6.38"
"History",38,"Killers of the Flower Moon: The Osage Murders and the Birth of the FBI","$19.68"
"History",39,"Slouching Towards Bethlehem: Essays","$1.99"
"History",40,"Martin Luther: The Man Who Rediscovered God and Changed the World","$0.00 with Trial"
"History",41,"The Devil in the White City","$0.00 with Trial"
"History",42,"Lean In: Women, Work, and the Will to Lead","$7.01"
"History",43,"The Art Of War","$4.99"
"History",44,"Andrew Jackson and the Miracle of New Orleans: The Battle That Shaped America's Destiny","$16.80"
"History",45,"Unholy Trinity: The Vatican’s Nazis, Soviet Intelligence and the Swiss Banks","$0.99"
"History",46,"Homo Deus: A Brief History of Tomorrow","$0.00 with Trial"
"History",47,"Horse Soldiers: The Extraordinary Story of a Band of US Soldiers Who Rode to Victory in Afghanistan","$10.89"
"History",48,"Ripper: The Secret Life of Walter Sickert [Kindle in Motion]","$1.99"
"History",49,"The Last Castle: The Epic Story of Love, Loss, and American Royalty in the Nation’s Largest Home","$18.30"
"History",50,"Fantasyland: How America Went Haywire: A 500-Year History","$0.00 with Trial"
"History",51,"Martin Luther: The Man Who Rediscovered God and Changed the World","$14.99"
"History",52,"Mad City: The True Story of the Campus Murders That America Forgot","$4.99"
"History",53,"Red Platoon: A True Story of American Valor","$1.99"
"History",54,"Washington: The Indispensable Man","$1.99"
"History",55,"The Boys in the Boat: Nine Americans and Their Epic Quest for Gold at the 1936 Berlin Olympics","$12.49"
"History",56,"Alexander Hamilton","$12.99"
"History",57,"The Sea Wolves: A History of the Vikings","$1.20"
"History",58,"Company Commander: The Classic Infantry Memoir of WWII","$1.49"
"History",59,"The Second World Wars: How the First Global Conflict Was Fought and Won","$22.99"
"History",60,"The Operator: Firing the Shots That Killed Osama Bin Laden and My Years as a SEAL Team Warrior","$0.00 with Trial"
"History",61,"Code Girls: The Untold Story of the American Women Code Breakers of World War II","$16.80"
"History",62,"Into the Wild","$9.81"
"History",63,"Red Famine: Stalin's War on Ukraine","$21.00"
"History",64,"The Rothschilds","$1.49"
"History",65,"Such Good Girls: The Journey of the Holocaust's Hidden Child Survivors","$1.99"
"History",66,"The Storm Before the Storm: The Beginning of the End of the Roman Republic","$17.70"
"History",67,"The Devil in the White City: Murder, Magic, and Madness at the Fair That Changed America","$12.39"
"History",68,"A Child's History of the World","$0.00 with Trial"
"History",69,"The Boys in the Boat: Nine Americans and Their Epic Quest for Gold at the 1936 Berlin Olympics","$0.00 with Trial"
"History",70,"The Last Castle: The Epic Story of Love, Loss, and American Royalty in the Nation's Largest Home","$14.99"
"History",71,"What She Ate: Six Remarkable Women and the Food That Tells Their Stories","$18.36"
"History",72,"1812: The War of 1812","$0.99"
"History",73,"Horse Soldiers: The Extraordinary Story of a Band of US Soldiers Who Rode to Victory in Afghanistan","$0.00 with Trial"
"History",74,"Benjamin Franklin: An American Life","$0.00 with Trial"
"History",75,"White Rage: The Unspoken Truth of Our Racial Divide","$11.55"
"History",76,"The Zulus at War: The History, Rise, and Fall of the Tribe That Washed Its Spears","$24.99"
"History",77,"Einstein: A Life of Genius (The True Story of Albert Einstein) (Historical Biographies of Famous People)","$2.99"
"History",78,"Fantasyland: How America Went Haywire: A 500-Year History","$21.66"
"History",79,"Tenements, Towers & Trash: An Unconventional Illustrated History of New York City","$21.99"
"History",80,"The Righteous Mind: Why Good People Are Divided by Politics and Religion","$12.04"
"History",81,"The Woman Who Smashed Codes: A True Story of Love, Spies, and the Unlikely Heroine Who Outwitted America's Enemies","$18.59"
"History",82,"The Lost City of the Monkey God: A True Story","$9.99"
"History",83,"Miss U: Angel of the Underground","$0.99"
"History",84,"Escape From Corregidor","$0.99"
"History",85,"Anne Frank: The Diary of a Young Girl","$6.29"
"History",86,"Manhunt: The 12-Day Chase to Catch Lincoln's Killer (P.S.)","$1.99"
"History",87,"Greater Gotham: A History of New York City from 1898 to 1919 (The History of NYC Series)","$34.65"
"History",88,"Horse Soldiers: The Extraordinary Story of a Band of US Soldiers Who Rode to Victory in Afghanistan","$13.99"
"History",89,"Red Notice: A True Story of High Finance, Murder, and One Man’s Fight for Justice","$11.55"
"History",90,"Einstein: His Life and Universe","$14.70"
"History",91,"A Train in Winter: An Extraordinary Story of Women, Friendship, and Resistance in Occupied France (The Resistance Trilogy Book 1)","$1.99"
"History",92,"A Short History of Nearly Everything","$0.00 with Trial"
"History",93,"Dark Money: The Hidden History of the Billionaires Behind the Rise of the Radical Right","$11.55"
"History",94,"The World of Lore: Monstrous Creatures","$0.00 with Trial"
"History",95,"D DAY Through German Eyes - Book Two - More hidden stories from June 6th 1944","$2.99"
"History",96,"Hidden Figures: The American Dream and the Untold Story of the Black Women Mathematicians Who Helped Win the Space Race","$12.70"
"History",97,"A People's History of the United States","$13.59"
"History",98,"Fantasyland: How America Went Haywire: A 500-Year History","$14.99"
"History",99,"God, Faith, and Reason","$17.10"
"History",100,"American Wolf: A True Story of Survival and Obsession in the West","$18.43"
"Humor Entertainment",1,"Leonardo da Vinci","$20.99"
"Humor Entertainment",2,"Yes Please","$2.99"
"Humor Entertainment",3,"Leonardo da Vinci","$16.99"
"Humor Entertainment",4,"We're Going to Need More Wine: Stories That Are Funny, Complicated, and True","$16.19"
"Humor Entertainment",5,"Born a Crime: Stories from a South African Childhood","$0.00 with Trial"
"Humor Entertainment",6,"We're Going to Need More Wine: Stories That Are Funny, Complicated, and True","$0.00 with Trial"
"Humor Entertainment",7,"Basketball (and Other Things): A Collection of Questions Asked, Answered, Illustrated","$11.99"
"Humor Entertainment",8,"I Can't Make This Up: Life Lessons","$0.00 with Trial"
"Humor Entertainment",9,"The Anthology Part 1 Limited Edition","$24.99"
"Humor Entertainment",10,"Xanathar's Guide to Everything","$29.97"
"Humor Entertainment",11,"Rhett & Link's Book of Mythicality: A Field Guide to Curiosity, Creativity, and Tomfoolery","$12.60"
"Humor Entertainment",12,"Recovery: Freedom from Our Addictions","$0.00 with Trial"
"Humor Entertainment",13,"Norbert’s Little Lessons for a Big Life","$11.15"
"Humor Entertainment",14,"The RBG Workout: How She Stays Strong . . . and You Can Too!","$9.64"
"Humor Entertainment",15,"Player's Handbook (Dungeons & Dragons)","$29.97"
"Humor Entertainment",16,"A Feast for Crows: A Song of Ice and Fire: Book 4","$0.00 with Trial"
"Humor Entertainment",17,"The Autobiography of Gucci Mane","$16.20"
"Humor Entertainment",18,"Mindset: The New Psychology of Success","$10.20"
"Humor Entertainment",19,"Recovery: Freedom from Our Addictions","$18.36"
"Humor Entertainment",20,"1984 (Signet Classics)","$5.99"
"Humor Entertainment",21,"Fahrenheit 451","$13.34"
"Humor Entertainment",22,"Eat What You Watch: A Cookbook for Movie Lovers","$15.00"
"Humor Entertainment",23,"We're Going to Need More Wine: Stories That Are Funny, Complicated, and True","$12.99"
"Humor Entertainment",24,"Al Franken, Giant of the Senate","$0.00 with Trial"
"Humor Entertainment",25,"The World's Largest Man: A Memoir","$1.99"
"Humor Entertainment",26,"Go the F**k to Sleep","$11.96"
"Humor Entertainment",27,"Dungeon Master's Guide (D&D Core Rulebook)","$32.41"
"Humor Entertainment",28,"Rhett & Link's Book of Mythicality: A Field Guide to Curiosity, Creativity, and Tomfoolery","$0.00 with Trial"
"Humor Entertainment",29,"Unbelievable: My Front-Row Seat to the Craziest Campaign in American History","$17.68"
"Humor Entertainment",30,"Monster Manual (D&D Core Rulebook)","$34.09"
"Humor Entertainment",31,"Unbelievable: My Front-Row Seat to the Craziest Campaign in American History","$12.99"
"Humor Entertainment",32,"Guinness World Records 2018: Meet our Real-Life Superheroes","$14.97"
"Humor Entertainment",33,"Adult Coloring Book: Stress Relieving Animal Designs","$5.99"
"Humor Entertainment",34,"The Magnolia Story","$13.49"
"Humor Entertainment",35,"Q&A a Day: 5-Year Journal","$13.87"
"Humor Entertainment",36,"Black Privilege: Opportunity Comes to Those Who Create It","$0.00 with Trial"
"Humor Entertainment",37,"Al Franken, Giant of the Senate","$14.99"
"Humor Entertainment",38,"Sticky Fingers: The Life and Times of Jann Wenner and Rolling Stone Magazine","$19.46"
"Humor Entertainment",39,"Calm the F*ck Down: An Irreverent Adult Coloring Book","$5.14"
"Humor Entertainment",40,"Animal farm: A Fairy Story","$8.87"
"Humor Entertainment",41,"Born a Crime: Stories from a South African Childhood","$14.99"
"Humor Entertainment",42,"Adult Coloring Book Designs: Stress Relief Coloring Book: Garden Designs, Mandalas, Animals, and Paisley Patterns","$4.99"
"Humor Entertainment",43,"My Mother Was Nuts","$0.99"
"Humor Entertainment",44,"Go F*ck Yourself, I'm Coloring: Swear Word Coloring Book","$5.39"
"Humor Entertainment",45,"Bossypants","$0.00 with Trial"
"Humor Entertainment",46,"You're Only Old Once!: A Book for Obsolete Children","$9.29"
"Humor Entertainment",47,"Al Franken, Giant of the Senate","$19.77"
"Humor Entertainment",48,"Modern Romance: An Investigation","$0.00 with Trial"
"Humor Entertainment",49,"The Legend of Zelda Encyclopedia","$23.99"
"Humor Entertainment",50,"Pokémon Deluxe Essential Handbook: The Need-to-Know Stats and Facts on Over 700 Pokémon","$8.79"
"Humor Entertainment",51,"Win Bigly: Persuasion in a World Where Facts Don't Matter","$17.70"
"Humor Entertainment",52,"You Are Not Small","$3.99"
"Humor Entertainment",53,"Pusheen the Cat 2018 Wall Calendar","$9.41"
"Humor Entertainment",54,"Recovery: Freedom from Our Addictions","$12.99"
"Humor Entertainment",55,"I'm Fine...and Other Lies","$0.00 with Trial"
"Humor Entertainment",56,"The Two-Night One-Night Stand","$0.99"
"Humor Entertainment",57,"How to Think: A Survival Guide for a World at Odds","$15.31"
"Humor Entertainment",58,"Fantasyland: How America Went Haywire: A 500-Year History","$0.00 with Trial"
"Humor Entertainment",59,"What If?: Serious Scientific Answers to Absurd Hypothetical Questions","$11.99"
"Humor Entertainment",60,"The Break","$28.19"
"Humor Entertainment",61,"Hamilton: The Revolution","$28.08"
"Humor Entertainment",62,"The Magnolia Story","$0.00 with Trial"
"Humor Entertainment",63,"Make Life Your Bitch: Motivational adult coloring book. Turn your stress into success! (Midnight Edition)","$4.49"
"Humor Entertainment",64,"Born a Crime: Stories from a South African Childhood","$19.17"
"Humor Entertainment",65,"Of Mess and Moxie: Wrangling Delight out of This Wild and Glorious Life","$0.00 with Trial"
"Humor Entertainment",66,"Essential Elements for Strings - Book 1 with EEi: Violin","$5.79"
"Humor Entertainment",67,"Swear Word Coloring Book: The Jungle Adult Coloring Book featured with Sweary Words & Animals","$4.04"
"Humor Entertainment",68,"A Simplified Life: Tactical Tools for Intentional Living","$12.21"
"Humor Entertainment",69,"Yes Please","$0.00 with Trial"
"Humor Entertainment",70,"The Anatomy Coloring Book","$18.49"
"Humor Entertainment",71,"The Art of Overwatch Limited Edition","$60.00"
"Humor Entertainment",72,"Adult All-In-One Course: Lesson-Theory-Technic: Level 1","$11.55"
"Humor Entertainment",73,"Searching for Dave Chappelle (Kindle Single)","$2.99"
"Humor Entertainment",74,"The Art of Overwatch","$31.44"
"Humor Entertainment",75,"Easy Origami (Dover Origami Papercraft)over 30 simple projects","$2.87"
"Humor Entertainment",76,"The Book of General Ignorance","$1.99"
"Humor Entertainment",77,"Dangerous","$0.00 with Trial"
"Humor Entertainment",78,"Teaching Little Fingers to Play: A Book for the Earliest Beginner (John Thompsons Modern Course for The Piano)","$4.05"
"Humor Entertainment",79,"The Great Gasbag: An A-to-Z Study Guide to Surviving Trump World","$16.50"
"Humor Entertainment",80,"Slaughterhouse-Five","$6.99"
"Humor Entertainment",81,"F*ck, That's Delicious: An Annotated Guide to Eating Well","$20.25"
"Humor Entertainment",82,"Primer Level - Lesson Book: Piano Adventures","$6.79"
"Humor Entertainment",83,"Black Privilege: Opportunity Comes to Those Who Create It","$12.99"
"Humor Entertainment",84,"The Girl with the Lower Back Tattoo","$0.00 with Trial"
"Humor Entertainment",85,"Theft by Finding: Diaries (1977-2002)","$0.00 with Trial"
"Humor Entertainment",86,"Lucky Number Eleven","$3.99"
"Humor Entertainment",87,"Church of the Small Things: The Million Little Pieces That Make Up a Life","$15.31"
"Humor Entertainment",88,"Fantasyland: How America Went Haywire: A 500-Year History","$21.66"
"Humor Entertainment",89,"Colorful Blessings: Cards to Color and Share","$3.76"
"Humor Entertainment",90,"Hand Lettering 101: An Introduction to the Art of Creative Lettering","$20.39"
"Humor Entertainment",91,"So Much I Want to Tell You: Letters to My Little Sister","$13.18"
"Humor Entertainment",92,"Volo's Guide to Monsters","$33.96"
"Humor Entertainment",93,"Everyday Watercolor: Learn to Paint Watercolor in 30 Days","$15.63"
"Humor Entertainment",94,"Standard Wirebound Manuscript Paper (Green Cover)","$4.99"
"Humor Entertainment",95,"Katie Daisy 2017 – 2018 On-the-Go Weekly Planner: 17-Month Calendar with Pocket","$13.49"
"Humor Entertainment",96,"Empathy and Eyebrows: A Survivalist's Stories on Reviving Your Spirit After Soul-Crushing Sh*tstorms","$0.00 with Trial"
"Humor Entertainment",97,"Coloring Book for Adults: Amazing Swirls","$5.99"
"Humor Entertainment",98,"Joan Rivers Confidential: The Unseen Scrapbooks, Joke Cards, Personal Files, and Photos of a Very Funny Woman Who Kept Everything","$25.47"
"Humor Entertainment",99,"Notebook Doodles Super Cute: Coloring & Activity Book (Design Originals)","$4.97"
"Humor Entertainment",100,"Wreck This Journal (Paper bag) Expanded Ed.","$8.49"
"Law",1,"Mindset: The New Psychology of Success","$10.20"
"Law",2,"Mindhunter: Inside the FBI's Elite Serial Crime Unit","$8.54"
"Law",3,"Mindhunter: Inside the FBI's Elite Serial Crime Unit","$11.51"
"Law",4,"Just Mercy: A Story of Justice and Redemption","$12.00"
"Law",5,"The New Jim Crow:  Mass Incarceration in the Age of Colorblindness","$13.56"
"Law",6,"Scalia Speaks: Reflections on Law, Faith, and Life Well Lived","$22.35"
"Law",7,"10 Actual, Official LSAT PrepTests Volume VI","$26.44"
"Law",8,"White Rage: The Unspoken Truth of Our Racial Divide","$11.55"
"Law",9,"The New Jim Crow: Mass Incarceration in the Age of Colorblindness","$0.00 with Trial"
"Law",10,"I Will Find You: Solving Killer Cases from My Life Fighting Crime (Homicide Hunter)","$17.70"
"Law",11,"Mindhunter: Inside the FBI's Elite Serial Crime Unit","$0.00 with Trial"
"Law",12,"Robert's Rules of Order Newly Revised","$11.21"
"Law",13,"Just Mercy: A Story of Justice and Redemption","$0.00 with Trial"
"Law",14,"The Color of Law: A Forgotten History of How Our Government Segregated America","$19.00"
"Law",15,"10 Actual, Official LSAT PrepTests Volume V: PrepTests 62 through 71 (Lsat Series)","$24.97"
"Law",16,"How to Debate Leftists and Destroy Them: 11 Rules for Winning the Argument","$0.99"
"Law",17,"All You Need to Know About the Music Business: Ninth Edition","$25.49"
"Law",18,"The Associated Press Stylebook 2017: and Briefing on Media Law (Associated Press Stylebook and Briefing on Media Law)","$14.95"
"Law",19,"The New Jim Crow","$9.99"
"Law",20,"Just Mercy: A Story of Justice and Redemption","$14.99"
"Law",21,"Scalia Speaks: Reflections on Law, Faith, and Life Well Lived","$14.99"
"Law",22,"The PowerScore LSAT Logic Games Bible (Powerscore LSAT Bible) (Powerscore Test Preparation)","$49.00"
"Law",23,"White Rage: The Unspoken Truth of Our Racial Divide","$8.51"
"Law",24,"Robert's Rules of Order Newly Revised In Brief, 2nd edition (Roberts Rules of Order in Brief)","$7.99"
"Law",25,"The PowerScore LSAT Logical Reasoning Bible","$50.25"
"Law",26,"I Can't Breathe: A Killing on Bay Street","$19.04"
"Law",27,"Chasing the Ripper (Kindle Single)","$1.99"
"Law",28,"Civil Procedure, 7th Edition (Examples & Explanations)","$39.86"
"Law",29,"Notorious RBG: The Life and Times of Ruth Bader Ginsburg","$12.50"
"Law",30,"The Official LSAT SuperPrep: The Champion of LSAT Prep","$18.03"
"Law",31,"Kaplan LSAT Premier 2016-2017 with Real Practice Questions: Book + Online (Kaplan Test Prep)","$40.77"
"Law",32,"LSAT Prep Book: Study Guide & Practice Test Questions for the Law School Admission Council's (LSAC) Law School Admission Test","$24.69"
"Law",33,"Dead Center: How Political Polarization Divided America and What We Can Do About It","$29.93"
"Law",34,"Blindsided: The True Story of One Man's Crusade Against Chemical Giant DuPont for a Boy with No Eyes","$0.99"
"Law",35,"Blockchain: Ultimate guide to understanding blockchain, bitcoin, cryptocurrencies, smart contracts and the future of money.","$2.99"
"Law",36,"BRAIN DAMAGE: A Juror's Tale: The Hammer Killing Trial","$3.99"
"Law",37,"10 New Actual, Official LSAT: PrepTests 52-61 (Lsat Series)","$24.97"
"Law",38,"Whoever Fights Monsters: My Twenty Years Tracking Serial Killers for the FBI","$0.00 with Trial"
"Law",39,"Scalia Speaks: Reflections on Law, Faith, and Life Well Lived","$0.00 with Trial"
"Law",40,"Impeachment: A Citizen’s Guide","$6.50"
"Law",41,"Black Titan: A.G. Gaston and the Making of a Black American Millionaire","$1.99"
"Law",42,"The PowerScore LSAT Reading Comprehension Bible","$47.43"
"Law",43,"The LSAT Trainer: A Remarkable Self-Study Guide For The Self-Driven Student","$61.34"
"Law",44,"Without a Doubt","$5.99"
"Law",45,"On Killing: The Psychological Cost of Learning to Kill in War and Society","$13.39"
"Law",46,"How to Remove ALL Negative Items from your Credit Report","$2.99"
"Law",47,"Journey Into Darkness (WWE)","$3.99"
"Law",48,"Hitler's American Model: The United States and the Making of Nazi Race Law","$18.45"
"Law",49,"Whoever Fights Monsters: My Twenty Years Tracking Serial Killers for the FBI","$8.22"
"Law",50,"Unhitched: Unlocking the Courage and Clarity to Get Unstuck from a Bad Marriage","$0.99"
"Law",51,"Why Nations Fail: The Origins of Power, Prosperity, and Poverty","$15.35"
"Law",52,"The Next 10 Actual, Official LSAT PrepTests (Lsat Series)","$20.40"
"Law",53,"White Rage: The Unspoken Truth of Our Racial Divide","$0.00 with Trial"
"Law",54,"The Cyanide Canary: A True Story of Injustice","$4.99"
"Law",55,"Rangers and Sovereignty","$0.99"
"Law",56,"Mind Hunter: Inside the FBI's Elite Serial Crime Unit","$0.00 with Trial"
"Law",57,"Blood in the Water: The Attica Prison Uprising of 1971 and Its Legacy","$14.28"
"Law",58,"Yes Vote: Public Hearing Plan for Developers","$0.99"
"Law",59,"Dead Center: How Political Polarization Divided America and What We Can Do about It","$19.95"
"Law",60,"The Official LSAT PrepTest 81: (June 2017 LSAT)","$8.87"
"Law",61,"The Chickenshit Club: Why the Justice Department Fails to Prosecute Executives","$17.92"
"Law",62,"Gorilla and the Bird: A Memoir of Madness and a Mother's Love","$18.36"
"Law",63,"The Dictator's Handbook: Why Bad Behavior is Almost Always Good Politics","$9.85"
"Law",64,"Emotional survival for law enforcement: A guide for officers and their families","$15.26"
"Law",65,"Licensed to Lie: Exposing Corruption in the Department of Justice","$28.95"
"Law",66,"J.K. Lasser's Your Income Tax 2018: For Preparing Your 2017 Tax Return","$24.29"
"Law",67,"Quicken Willmaker Plus 2017 Edition: Book & Software Kit","$39.91"
"Law",68,"Never Caught: The Washingtons' Relentless Pursuit of Their Runaway Slave, Ona Judge","$17.68"
"Law",69,"My Own Words","$20.40"
"Law",70,"Examples & Explanations: The Law of Torts","$37.18"
"Law",71,"Examples & Explanations for Contracts","$50.30"
"Law",72,"Whoever Fights Monsters: My Twenty Years Tracking Serial Killers for the FBI","$8.99"
"Law",73,"The Color of Law: A Forgotten History of How Our Government Segregated America","$9.18"
"Law",74,"War Against All Puerto Ricans: Revolution and Terror in America's Colony","$13.82"
"Law",75,"Constitution of the United States (Little Books of Wisdom)","$8.99"
"Law",76,"The Quest for Cosmic Justice","$0.00 with Trial"
"Law",77,"The Cases That Haunt Us: From Jack the Ripper to Jon Benet Ramsey, The FBI's Legendary Mindhunter Sheds New Light on the Mysteries That Won't Go Away","$7.99"
"Law",78,"Swear Word Coloring Book ( Nights Edition).: 40 Sweary Designs .(Relaxing  Coloring Book with Sweary Coloring Book For Fun)","$5.37"
"Law",79,"Why Nations Fail: The Origins of Power, Prosperity, and Poverty","$0.00 with Trial"
"Law",80,"The Distance Between Us: A Memoir","$12.24"
"Law",81,"10 Actual, Official LSAT PrepTests","$19.72"
"Law",82,"Catch The Jew!: Eye-opening education - You will never look at Israel the same way again","$8.72"
"Law",83,"The End of Policing","$18.32"
"Law",84,"Get It Together: Organize Your Records So Your Family Won't Have To","$16.99"
"Law",85,"The Tools of Argument: How the Best Lawyers Think, Argue, and Win","$11.88"
"Law",86,"Half the Sky: Turning Oppression into Opportunity for Women Worldwide","$9.84"
"Law",87,"The Color of Money: Black Banks and the Racial Wealth Gap","$20.04"
"Law",88,"Honeymoon With A Killer","$5.99"
"Law",89,"Mindhunter: Inside the FBI's Elite Serial Crime Unit","$8.99"
"Law",90,"The Color of Law: A Forgotten History of How Our Government Segregated America","$0.00 with Trial"
"Law",91,"Eichmann in Jerusalem: A Report on the Banality of Evil (Penguin Classics)","$10.33"
"Law",92,"Incognito: The Secret Lives of the Brain","$10.57"
"Law",93,"The Cases That Haunt Us: From Jack the Ripper to JonBenet Ramsey, the FBI's Legendary Mindhunter Sheds Light on the Mysteries That Won't Go Away","$0.00 with Trial"
"Law",94,"The Bluebook: A Uniform System of Citation, 20th Edition","$31.00"
"Law",95,"Ethical Dilemmas and Decisions in Criminal Justice","$99.94"
"Law",96,"A Piece of Cake: A Memoir","$12.38"
"Law",97,"I Can't Breathe: A Killing on Bay Street","$14.99"
