"category","rank","titles","prices"
"Computers Technology",17,"Hands-On Machine Learning with Scikit-Learn and TensorFlow: Concepts, Tools, and Techniques to Build Intelligent Systems","$33.31"
"Computers Technology",18,"The Personal Internet Address & Password Log Book","$6.15"
"Computers Technology",19,"The Everything Store: Jeff Bezos and the Age of Amazon","$0.00 with Trial"
"Computers Technology",20,"Fanatical Prospecting: The Ultimate Guide for Starting Sales Conversations and Filling the Pipeline by Leveraging Social Selling, Telephone, E-Mail, and Cold Calling","$0.00 with Trial"
"Computers Technology",21,"iGen: Why Today’s Super-Connected Kids Are Growing Up Less Rebellious, More Tolerant, Less Happy--and Completely Unprepared for Adulthood--and What That Means for the Rest of Us","$22.62"
"Computers Technology",22,"Steve Jobs","$0.00 with Trial"
"Computers Technology",23,"The Four: The Hidden DNA of Amazon, Apple, Facebook, and Google","$14.99"
"Computers Technology",24,"The Legend of Zelda: Breath of the Wild: The Complete Official Guide Collector's Edition","$34.78"
"Computers Technology",25,"Cryptoassets: The Innovative Investor's Guide to Bitcoin and Beyond","$16.50"
"Computers Technology",26,"The Phoenix Project: A Novel about IT, DevOps, and Helping Your Business Win","$16.53"
"Computers Technology",27,"Ultimate Guide to Google AdWords: How to Access 100 Million People in 10 Minutes (Ultimate Series)","$18.78"
"Computers Technology",28,"Subway Surfers - Ultimate","$2.99"
"Computers Technology",29,"Hit Refresh: The Quest to Rediscover Microsoft's Soul and Imagine a Better Future for Everyone","$15.99"
"Computers Technology",30,"The Legend of Zelda: Art & Artifacts","$23.99"
"Computers Technology",31,"Deep Learning (Adaptive Computation and Machine Learning series)","$61.60"
"Computers Technology",32,"Master Todoist: How to Use a Simple App to Create Actionable To-Do Lists and Organize Your Life","$2.99"
"Computers Technology",33,"Everybody Lies: Big Data, New Data, and What the Internet Can Tell Us About Who We Really Are","$13.99"
"Computers Technology",34,"The Legend of Zelda: Hyrule Historia","$22.69"
"Computers Technology",35,"slither.io","$2.99"
"Computers Technology",36,"Overwatch: Anthology Volume 1","$15.61"
"Computers Technology",37,"Life 3.0: Being Human in the Age of Artificial Intelligence","$15.99"
"Computers Technology",38,"CompTIA A+ Certification All-in-One Exam Guide, Ninth Edition (Exams 220-901 & 220-902)","$43.54"
"Computers Technology",39,"Life 3.0: Being Human in the Age of Artificial Intelligence","$18.30"
"Computers Technology",40,"Python Crash Course: A Hands-On, Project-Based Introduction to Programming","$27.16"
"Computers Technology",41,"Clean Architecture: A Craftsman's Guide to Software Structure and Design (Robert C. Martin Series)","$31.27"
"Computers Technology",42,"Playing With Super Power: Nintendo Super NES Classics","$14.40"
"Computers Technology",43,"DotCom Secrets: The Underground Playbook for Growing Your Company Online","$12.65"
"Computers Technology",44,"#AskGaryVee: One Entrepreneur's Take on Leadership, Social Media, and Self-Awareness","$0.00 with Trial"
"Computers Technology",45,"Sitting Duck","$19.95"
"Computers Technology",46,"Fanatical Prospecting: The Ultimate Guide to Opening Sales Conversations and Filling the Pipeline by Leveraging Social Selling, Telephone, Email, Text, and Cold Calling","$19.44"
"Computers Technology",47,"Weapons of Math Destruction: How Big Data Increases Inequality and Threatens Democracy","$12.00"
"Computers Technology",48,"Thing Explainer: Complicated Stuff in Simple Words","$13.99"
"Computers Technology",49,"Blood, Sweat, and Pixels: The Triumphant, Turbulent Stories Behind How Video Games Are Made","$0.00 with Trial"
"Computers Technology",50,"Reclaiming Conversation: The Power of Talk in a Digital Age","$1.99"
"Computers Technology",51,"Python for Data Analysis: Data Wrangling with Pandas, NumPy, and IPython","$36.24"
"Computers Technology",52,"AWS Certified Solutions Architect Official Study Guide: Associate Exam","$37.43"
"Computers Technology",53,"Excel 2016 All-in-One For Dummies (For Dummies (Computer/Tech))","$30.19"
"Computers Technology",54,"Kindle Unlimited: How To Cancel Your Kindle Unlimited Subscription By Just Using Three Easy Steps In Under Two Minutes (A Short Guide On Canceling Your Kindle Unlimited Subscription In No Time)","$0.99"
"Computers Technology",55,"Wimpy Steve Book 1: Trapped in Minecraft! (An Unofficial Minecraft Diary Book) (Minecraft Diary: Wimpy Steve)","$2.99"
"Computers Technology",56,"CompTIA Security+: Get Certified Get Ahead: SY0-401 Study Guide","$33.88"
"Computers Technology",57,"Final Fantasy Ultimania Archive Volume 1","$34.24"
"Computers Technology",58,"SEO 2017: Learn search engine optimization with smart internet marketing strategies","$5.99"
"Computers Technology",59,"Assassin's Creed Origins: Prima Collector's Edition Guide","$35.99"
"Computers Technology",60,"Understanding Exposure, Fourth Edition: How to Shoot Great Photographs with Any Camera","$18.35"
"Computers Technology",61,"Blockchain Revolution: How the Technology Behind Bitcoin Is Changing Money, Business, and the World","$0.00 with Trial"
"Computers Technology",62,"Rtfm: Red Team Field Manual","$9.00"
"Computers Technology",63,"Clean Code: A Handbook of Agile Software Craftsmanship","$34.16"
"Computers Technology",64,"Mastering Bitcoin for Starters: Bitcoin and Cryptocurrency Technologies, Mining, Investing and Trading - Bitcoin Book 1, Blockchain, Wallet, Business","$2.99"
"Computers Technology",65,"Mastering Bitcoin: Programming the Open Blockchain","$27.99"
"Computers Technology",66,"Ti 84 Plus Calculator (Quick Study Academic)","$5.24"
"Computers Technology",67,"The Conversion Code: Capture Internet Leads, Create Quality Appointments, Close More Sales","$0.00 with Trial"
"Computers Technology",68,"Blue Team Field Manual (BTFM) (RTFM)","$13.49"
"Computers Technology",69,"The Legend of Zelda: Breath of the Wild Deluxe Edition: The Complete Official Guide","$74.00"
"Computers Technology",70,"Super Mario Odyssey: Prima Official Guide","$12.00"
"Computers Technology",71,"Super Mario Odyssey: Prima Collector's Edition Guide","$33.99"
"Computers Technology",72,"Superintelligence: Paths, Dangers, Strategies","$12.01"
"Computers Technology",73,"Diary of Steve the Noob 1 (An Unofficial Minecraft Book) (Minecraft Diary Steve the Noob Collection)","$0.99"
"Computers Technology",74,"Microsoft Excel 2016 Introduction Quick Reference Guide - Windows Version (Cheat Sheet of Instructions, Tips & Shortcuts - Laminated Card)","$2.98"
"Computers Technology",75,"Make Your Own Neural Network","$3.98"
"Computers Technology",76,"Designing Data-Intensive Applications: The Big Ideas Behind Reliable, Scalable, and Maintainable Systems","$32.83"
"Computers Technology",77,"Programming Arduino: Getting Started with Sketches, Second Edition (Tab)","$8.48"
"Computers Technology",78,"Mastering Bitcoin: Programming the Open Blockchain","$9.80"
"Computers Technology",79,"R for Data Science: Import, Tidy, Transform, Visualize, and Model Data","$31.99"
"Computers Technology",80,"Steve Jobs","$11.90"
"Computers Technology",81,"CCENT/CCNA ICND1 100-105 Official Cert Guide","$20.77"
"Computers Technology",82,"CompTIA Network+ All-In-One Exam Guide, Sixth Edition (Exam N10-006)","$46.40"
"Computers Technology",83,"Subway Surfers","$2.99"
"Computers Technology",84,"Don't Make Me Think, Revisited: A Common Sense Approach to Web Usability (3rd Edition) (Voices That Matter)","$33.80"
"Computers Technology",85,"HTML and CSS: Design and Build Websites","$20.09"
"Computers Technology",86,"Jab, Jab, Jab, Right Hook: How to Tell Your Story in a Noisy Social World","$22.88"
"Computers Technology",87,"First Little Readers Parent Pack: Guided Reading Level C: 25 Irresistible Books That Are Just the Right Level for Beginning Readers","$14.39"
"Computers Technology",88,"SQL in 10 Minutes, Sams Teach Yourself (4th Edition)","$25.65"
"Computers Technology",89,"Pokémon Ultra Sun & Pokémon Ultra Moon: The Official Alola Region Strategy Guide","$21.24"
"Computers Technology",90,"Cracking the PM Interview: How to Land a Product Manager Job in Technology","$9.99"
"Computers Technology",91,"CISSP (ISC)2 Certified Information Systems Security Professional Official Study Guide","$35.29"
"Computers Technology",92,"Technology-as-a-Service Playbook: How to Grow a Profitable Subscription Business","$17.64"
"Computers Technology",93,"Blockchain: Ultimate guide to understanding blockchain, bitcoin, cryptocurrencies, smart contracts and the future of money.","$2.99"
"Computers Technology",94,"Hands-On Machine Learning with Scikit-Learn and TensorFlow: Concepts, Tools, and Techniques to Build Intelligent Systems","$24.99"
"Computers Technology",95,"Temple Run 1: Unofficial Underground Tips & Secrets Guide","$4.67"
"Computers Technology",96,"Blood, Sweat, and Pixels: The Triumphant, Turbulent Stories Behind How Video Games Are Made","$10.87"
"Computers Technology",97,"How To Create A Podcast","$2.99"
"Computers Technology",98,"Shit I Can't Remember: An Organizer for All Your Passwords and Shit","$4.46"
"Computers Technology",99,"Subway Surfers: The Unofficial Players Guide for Game Tips & Secrets","$4.47"
"Computers Technology",100,"Cracking the PM Interview: How to Land a Product Manager Job in Technology","$31.67"
"Cookbooks Food Wine",1,"Thug Kitchen: The Official Cookbook: Eat Like You Give a F*ck","$9.99"
"Cookbooks Food Wine",2,"Rocco's Healthy & Delicious: More than 200 (Mostly) Plant-Based Recipes for Everyday Life","$18.38"
"Cookbooks Food Wine",3,"The Pioneer Woman Cooks: Come and Get It!: Simple, Scrumptious Recipes for Crazy Busy Lives","$17.89"
"Cookbooks Food Wine",4,"The Keto Reset Diet: Reboot Your Metabolism in 21 Days and Burn Fat Forever","$16.94"
"Cookbooks Food Wine",5,"The Instant Pot® Electric Pressure Cooker Cookbook: Easy Recipes for Fast & Healthy Meals","$9.71"
"Cookbooks Food Wine",6,"Rasika: Flavors of India","$22.48"
"Cookbooks Food Wine",7,"Quick & Easy Korean Cooking: More Than 70 Everyday Recipes (Gourmet Cook Book Club Selection (Paperback))","$2.99"
"Cookbooks Food Wine",8,"The Whole30: The 30-Day Guide to Total Health and Food Freedom","$19.14"
"Cookbooks Food Wine",9,"The Complete Anti-Inflammatory Diet for Beginners: A No-Stress Meal Plan with Easy Recipes to Heal the Immune System","$1.99"
"Cookbooks Food Wine",10,"Night + Market: Delicious Thai Food to Facilitate Drinking and Fun-Having Amongst Friends","$22.48"
"Cookbooks Food Wine",11,"Dinner in an Instant: 75 Modern Recipes for Your Pressure Cooker, Multicooker, and Instant Pot®","$14.71"
"Cookbooks Food Wine",12,"The Beer Bible: The Essential Beer Lover’s Guide","$0.99"
"Cookbooks Food Wine",13,"The Complete Ketogenic Diet for Beginners: Your Essential Guide to Living the Keto Lifestyle","$10.15"
"Cookbooks Food Wine",14,"Lidia's Celebrate Like an Italian: 220 Foolproof Recipes That Make Every Meal a Party","$22.48"
"Cookbooks Food Wine",15,"Thug Kitchen: The Official Cookbook: Eat Like You Give a F*ck","$15.59"
"Cookbooks Food Wine",16,"The Keto Diet: The Complete Guide to a High-Fat Diet, with More Than 125 Delectable Recipes and 5 Meal Plans to Shed Weight, Heal Your Body, and Regain Confidence","$21.50"
"Cookbooks Food Wine",17,"The Complete Ketogenic Diet for Beginners: Your Essential Guide to Living the Keto Lifestyle","$2.99"
"Cookbooks Food Wine",18,"Paleo Principles","$30.62"
"Cookbooks Food Wine",19,"The Easy Homemade Cookie Cookbook: Simple Recipes for the Best Chocolate Chip Cookies, Brownies, Christmas Treats and Other American Favorites","$1.99"
"Cookbooks Food Wine",20,"Eat What You Watch: A Cookbook for Movie Lovers","$15.00"
"Cookbooks Food Wine",21,"Smitten Kitchen Every Day: Triumphant and Unfussy New Favorites","$22.30"
"Cookbooks Food Wine",22,"The How Not to Die Cookbook: 100+ Recipes to Help Prevent and Reverse Disease","$20.39"
"Cookbooks Food Wine",23,"Trim Healthy Mama's Trim Healthy Table: More Than 300 All-New Healthy and Delicious Recipes from Our Homes to Yours","$20.86"
"Cookbooks Food Wine",24,"The Complete Idiot's Guide to Fermenting Foods (Idiot's Guides)","$1.99"
"Cookbooks Food Wine",25,"Forks Over Knives - The Cookbook: Over 300 Recipes for Plant-Based Eating All Through the Year","$11.89"
"Cookbooks Food Wine",26,"The Chef and the Slow Cooker","$17.99"
"Cookbooks Food Wine",27,"Mark Bittman's Kitchen Matrix: More Than 700 Simple Recipes and Techniques to Mix and Match for Endless Possibilities","$2.99"
"Cookbooks Food Wine",28,"The Whole30 Fast & Easy Cookbook: 150 Simply Delicious Everyday Recipes for Your Whole30","$19.49"
"Cookbooks Food Wine",29,"Instant Pot® Electric Pressure Cooker Cookbook: Easy Recipes for Fast & Healthy Meals","$2.99"
"Cookbooks Food Wine",30,"The Whole30 Cookbook: 150 Delicious and Totally Compliant Recipes to Help You Succeed with the Whole30 and Beyond","$21.00"
"Cookbooks Food Wine",31,"Air Fry Everything: Foolproof Recipes for Fried Favorites and Easy Fresh Ideas by Blue Jean Chef, Meredith Laurence (The Blue Jean Chef)","$17.93"
"Cookbooks Food Wine",32,"Indian Instant Pot® Cookbook: Traditional Indian Dishes Made Easy and Fast","$10.33"
"Cookbooks Food Wine",33,"Atkins: Eat Right, Not Less: Your Guidebook for Living a Low-Carb and Low-Sugar Lifestyle","$19.49"
"Cookbooks Food Wine",34,"The Keto Reset Diet: Reboot Your Metabolism in 21 Days and Burn Fat Forever","$14.99"
"Cookbooks Food Wine",35,"The Kimchi Cookbook: 60 Traditional and Modern Ways to Make and Eat Kimchi","$1.99"
"Cookbooks Food Wine",36,"Instant Pot CookBook: 550 Recipes For Every Day. Healthy and Delicious Meals. Nutrition Facts Per Serving. Simple and Clear Instructions.","$10.46"
"Cookbooks Food Wine",37,"The Whole30 Day by Day: Your Daily Guide to Whole30 Success","$13.38"
"Cookbooks Food Wine",38,"Fat for Fuel Ketogenic Cookbook: Recipes and Ketogenic Keys to Health from a World-Class Doctor and an Internationally Renowned Chef","$19.49"
"Cookbooks Food Wine",39,"Instant Pot® Obsession: The Ultimate Electric Pressure Cooker Cookbook for Cooking Everything Fast","$11.41"
"Cookbooks Food Wine",40,"Sweet: Desserts from London's Ottolenghi","$22.46"
"Cookbooks Food Wine",41,"The Essential Instant Pot Cookbook: Fresh and Foolproof Recipes for Your Electric Pressure Cooker","$13.49"
"Cookbooks Food Wine",42,"Skinnytaste Fast and Slow: Knockout Quick-Fix and Slow Cooker Recipes","$19.84"
"Cookbooks Food Wine",43,"Beating Cancer with Nutrition (Fourth Edition) Rev","$6.38"
"Cookbooks Food Wine",44,"My Kitchen Year: 136 Recipes That Saved My Life","$1.99"
"Cookbooks Food Wine",45,"History Food - From Paleo Era to Renaissance","$9.99"
"Cookbooks Food Wine",46,"Dr. Gundry's Diet Evolution: Turn Off the Genes That Are Killing You and Your Waistline","$13.58"
"Cookbooks Food Wine",47,"Cravings: Recipes for All the Food You Want to Eat","$18.45"
"Cookbooks Food Wine",48,"The Healthy Meal Prep Cookbook: Easy and Wholesome Meals to Cook, Prep, Grab, and Go","$12.97"
"Cookbooks Food Wine",49,"The Complete Air Fryer Cookbook: Amazingly Easy Recipes to Fry, Bake, Grill, and Roast with Your Air Fryer","$12.74"
"Cookbooks Food Wine",50,"The Everyday Ketogenic Kitchen: With More than 150 Inspirational Low-Carb, High-Fat Recipes to Maximize Your Health","$26.45"
"Cookbooks Food Wine",51,"Salt, Fat, Acid, Heat: Mastering the Elements of Good Cooking","$23.79"
"Cookbooks Food Wine",52,"The Food Lab: Better Home Cooking Through Science","$33.96"
"Cookbooks Food Wine",53,"Thai Slow Cooker Cookbook","$0.99"
"Cookbooks Food Wine",54,"Ready or Not!: 150+ Make-Ahead, Make-Over, and Make-Now Recipes by Nom Nom Paleo","$22.28"
"Cookbooks Food Wine",55,"What Can I Bring?: Southern Food for Any Occasion Life Serves Up","$19.49"
"Cookbooks Food Wine",56,"The Keto Reset Diet: Reboot Your Metabolism in 21 Days and Burn Fat Forever","$0.00 with Trial"
"Cookbooks Food Wine",57,"Instant Pot Cookbook: 550 Instant Pot Recipes. Delicious Dishes For Two And For The Whole Family.","$2.99"
"Cookbooks Food Wine",58,"Master Bits & Mercenary Bites~Girls Night","$3.99"
"Cookbooks Food Wine",59,"Paleo for Beginners: Essentials to Get Started","$8.49"
"Cookbooks Food Wine",60,"Keto Slow Cooker & One-Pot Meals: Over 100 Simple & Delicious Low-Carb, Paleo and Primal Recipes for Weight Loss and Better Health","$15.27"
"Cookbooks Food Wine",61,"Instant Pot Cookbook: 550 Delicious Dishes Recipes, Healthy Meals.","$11.01"
"Cookbooks Food Wine",62,"The Pioneer Woman Cooks: Dinnertime - Comfort Classics, Freezer Food, 16-minute Meals, and Other Delicious Ways to Solve Supper","$22.49"
"Cookbooks Food Wine",63,"What She Ate: Six Remarkable Women and the Food That Tells Their Stories","$18.36"
"Cookbooks Food Wine",64,"F*ck, That's Delicious: An Annotated Guide to Eating Well","$20.25"
"Cookbooks Food Wine",65,"Quick & Easy Ketogenic Cooking: Meal Plans and Time Saving Paleo Recipes to Inspire Health and Shed Weight","$23.70"
"Cookbooks Food Wine",66,"Green Smoothies for Life","$15.99"
"Cookbooks Food Wine",67,"The Skinnytaste Cookbook: Light on Calories, Big on Flavor","$20.19"
"Cookbooks Food Wine",68,"Rocco's Healthy & Delicious: More than 200 (Mostly) Plant-Based Recipes for Everyday Life","$14.99"
"Cookbooks Food Wine",69,"Valerie's Home Cooking: More than 100 Delicious Recipes to Share with Friends and Family","$20.98"
"Cookbooks Food Wine",70,"The Wicked Good Ketogenic Diet Cookbook: Easy, Whole Food Keto Recipes for Any Budget","$6.99"
"Cookbooks Food Wine",71,"Appetites: A Cookbook","$27.76"
"Cookbooks Food Wine",72,"Eat to Live Quick and Easy Cookbook: 131 Delicious Recipes for Fast and Sustained Weight Loss, Reversing Disease, and Lifelong Health","$11.49"
"Cookbooks Food Wine",73,"The Complete Mediterranean Cookbook: 500 Vibrant, Kitchen-Tested Recipes for Living and Eating Well Every Day","$23.77"
"Cookbooks Food Wine",74,"The Super Easy Vegan Slow Cooker Cookbook: 100 Easy, Healthy Recipes That Are Ready When You Are","$12.71"
"Cookbooks Food Wine",75,"The Chocolate Touch","$5.99"
"Cookbooks Food Wine",76,"The 30-Day Ketogenic Cleanse: Reset Your Metabolism with 160 Tasty Whole-Food Recipes & Meal Plans","$23.76"
"Cookbooks Food Wine",77,"Ketogenic Diet: 365 Days of Ketogenic Diet Recipes (Ketogenic, Ketogenic Cookbook, Keto, For Beginners, Kitchen, Cooking, Diet Plan, Cleanse, Healthy, Low Carb, Paleo, Meals, Whole Food, Weight Loss)","$0.99"
"Cookbooks Food Wine",78,"Meehan's Bartender Manual","$25.47"
"Cookbooks Food Wine",79,"Instant Pot Miracle: From Gourmet to Everyday, 175 Must-Have Recipes","$17.74"
"Cookbooks Food Wine",80,"The Keto Diet: The Complete Guide to a High-Fat Diet, with More Than 125 Delectable Recipes and 5 Meal Plans to Shed Weight, Heal Your Body, and Regain Confidence","$9.99"
"Cookbooks Food Wine",81,"Kitchen Confidential","$7.39"
"Cookbooks Food Wine",82,"Ketogenic Diet :The Step by Step Guide For Beginners: Ketogenic Diet For Beginners : Ketogenic Diet For Weight Loss : Keto Diet : The Step by Step Guide For Beginners","$2.99"
"Cookbooks Food Wine",83,"The Negative Calorie Diet: Lose Up to 10 Pounds in 10 Days with 10 All You Can Eat Foods","$17.63"
"Cookbooks Food Wine",84,"Clean Eating: Change Your Mindset, Lose Weight Fast and Keep It Off Forever","$3.99"
"Cookbooks Food Wine",85,"Half Baked Harvest Cookbook: Recipes from My Barn in the Mountains","$19.47"
"Cookbooks Food Wine",86,"CROCKPOT DUMP MEALS: Delicious Dump Meals, Dump Dinners Recipes For Busy People (crock pot dump meals, crockpot dump dinners, dump dinners)","$2.99"
"Cookbooks Food Wine",87,"Instant Pot Cookbook: 550 Recipes For Every Day. Healthy and Delicious Meals. Nutrition Facts & Calories. Simple and Clear Instructions.","$2.99"
"Cookbooks Food Wine",88,"101 Asian Dishes You Need to Cook Before You Die: Discover a New World of Flavors in Authentic Recipes","$14.95"
"Cookbooks Food Wine",89,"Love Real Food: More Than 100 Feel-Good Vegetarian Favorites to Delight the Senses and Nourish the Body","$18.70"
"Cookbooks Food Wine",90,"The Fast Metabolism Diet Cookbook: Eat Even More Food and Lose Even More Weight","$15.89"
"Cookbooks Food Wine",91,"All Time Best Holiday Entertaining","$15.60"
"Cookbooks Food Wine",92,"The Nerdy Nummies Cookbook: Sweet Treats for the Geek in All of Us","$16.94"
"Cookbooks Food Wine",93,"Inspiralized: Turn Vegetables into Healthy, Creative, Satisfying Meals","$15.90"
"Cookbooks Food Wine",94,"The Oh She Glows Cookbook: Over 100 Vegan Recipes to Glow from the Inside Out","$19.45"
"Cookbooks Food Wine",95,"Mad Genius Tips: Over 90 Expert Hacks and 100 Delicious Recipes","$16.68"
"Cookbooks Food Wine",96,"Thug Kitchen 101: Fast as F*ck","$18.35"
"Cookbooks Food Wine",97,"Danielle Walker's Against All Grain: Meals Made Simple: Gluten-Free, Dairy-Free, and Paleo Recipes to Make Anytime","$19.65"
"Cookbooks Food Wine",98,"The Complete Air Fryer Cookbook: Amazingly Easy Recipes to Fry, Bake, Grill, and Roast with Your Air Fryer","$6.99"
"Cookbooks Food Wine",99,"Keto Comfort Foods","$22.32"
"Cookbooks Food Wine",100,"The Big Book of Organic Baby Food: Baby Purées, Finger Foods, and Toddler Meals For Every Stage","$11.55"
"Crafts Hobbies Home",1,"The Life-Changing Magic of Tidying Up: The Japanese Art of Decluttering and Organizing","$9.79"
"Crafts Hobbies Home",2,"How Dogs Love Us: A Neuroscientist and His Adopted Dog Decode the Canine Brain","$0.99"
"Crafts Hobbies Home",3,"Adult Coloring Book: Stress Relieving Animal Designs","$5.99"
"Crafts Hobbies Home",4,"The Magnolia Story","$13.49"
"Crafts Hobbies Home",5,"Q&A a Day: 5-Year Journal","$13.87"
"Crafts Hobbies Home",6,"Calm the F*ck Down: An Irreverent Adult Coloring Book","$5.14"
"Crafts Hobbies Home",7,"Adult Coloring Book Designs: Stress Relief Coloring Book: Garden Designs, Mandalas, Animals, and Paisley Patterns","$4.99"
"Crafts Hobbies Home",8,"Go F*ck Yourself, I'm Coloring: Swear Word Coloring Book","$5.39"
"Crafts Hobbies Home",9,"The Knot Ultimate Wedding Planner & Organizer [binder edition]: Worksheets, Checklists, Etiquette, Calendars, and Answers to Frequently Asked Questions","$23.59"
"Crafts Hobbies Home",10,"The Life-Changing Magic of Tidying Up: The Japanese Art of Decluttering and Organizing","$0.00 with Trial"
"Crafts Hobbies Home",11,"2017-2018 Academic Planner Weekly And Monthly: Calendar Schedule Organizer and Journal Notebook With Inspirational Quotes And Floral Lettering Cover","$7.75"
"Crafts Hobbies Home",12,"Pusheen the Cat 2018 Wall Calendar","$9.41"
"Crafts Hobbies Home",13,"The Last Castle: The Epic Story of Love, Loss, and American Royalty in the Nation’s Largest Home","$18.30"
"Crafts Hobbies Home",14,"Make Life Your Bitch: Motivational adult coloring book. Turn your stress into success! (Midnight Edition)","$4.49"
"Crafts Hobbies Home",15,"The Gentle Art of Swedish Death Cleaning: How to Free Yourself and Your Family from a Lifetime of Clutter","$13.05"
"Crafts Hobbies Home",16,"Swear Word Coloring Book: The Jungle Adult Coloring Book featured with Sweary Words & Animals","$4.04"
"Crafts Hobbies Home",17,"A Simplified Life: Tactical Tools for Intentional Living","$12.21"
"Crafts Hobbies Home",18,"Handbook For The Recently Deceased","$9.89"
"Crafts Hobbies Home",19,"The Anatomy Coloring Book","$18.49"
"Crafts Hobbies Home",20,"Easy Origami (Dover Origami Papercraft)over 30 simple projects","$2.87"
"Crafts Hobbies Home",21,"The Last Castle: The Epic Story of Love, Loss, and American Royalty in the Nation's Largest Home","$14.99"
"Crafts Hobbies Home",22,"Killer, Paper, Cut: Book # 9 in the Kiki Lowenstein Mystery Series (A Kiki Lowenstein Scrap-N-Craft Mystery)","$0.99"
"Crafts Hobbies Home",23,"Colorful Blessings: Cards to Color and Share","$3.76"
"Crafts Hobbies Home",24,"Hand Lettering 101: An Introduction to the Art of Creative Lettering","$20.39"
"Crafts Hobbies Home",25,"Outlander","$9.99"
"Crafts Hobbies Home",26,"The Life-Changing Magic of Tidying Up: The Japanese Art of Decluttering and Organizing","$9.99"
"Crafts Hobbies Home",27,"Everyday Watercolor: Learn to Paint Watercolor in 30 Days","$15.63"
"Crafts Hobbies Home",28,"Ugly's Electrical References, 2017 Edition","$14.99"
"Crafts Hobbies Home",29,"Coloring Book for Adults: Amazing Swirls","$5.99"
"Crafts Hobbies Home",30,"Notebook Doodles Super Cute: Coloring & Activity Book (Design Originals)","$4.97"
"Crafts Hobbies Home",31,"Wreck This Journal (Paper bag) Expanded Ed.","$8.49"
"Crafts Hobbies Home",32,"Kaleidoscope Wonders: Color Art for Everyone","$5.14"
"Crafts Hobbies Home",33,"Thomas Kinkade: The Disney Dreams Collection 2018 Wall Calendar","$10.39"
"Crafts Hobbies Home",34,"Training the Best Dog Ever: A 5-Week Program Using the Power of Positive Reinforcement","$13.56"
"Crafts Hobbies Home",35,"The Lego Ideas Book: Unlock Your Imagination","$17.86"
"Crafts Hobbies Home",36,"Fucking Adorable - Cute Critters with foul Mouths","$4.49"
"Crafts Hobbies Home",37,"Art of Coloring: Tim Burton's The Nightmare Before Christmas: 100 Images to Inspire Creativity","$12.38"
"Crafts Hobbies Home",38,"One Line a Day: A Five-Year Memory Book","$15.26"
"Crafts Hobbies Home",39,"365 Cats Page-A-Day Calendar 2018","$10.39"
"Crafts Hobbies Home",40,"Creative Haven Autumn Scenes Coloring Book (Adult Coloring)","$5.09"
"Crafts Hobbies Home",41,"Adult Coloring Book: Island Dreams: Vacation, Summer and Beach: Dream and Relax with Gorgeous Illustrations","$4.49"
"Crafts Hobbies Home",42,"Descendants 2 A Wickedly Cool Coloring Book (Art of Coloring)","$11.18"
"Crafts Hobbies Home",43,"The Unlikely Lavender Queen: A Memoir of Unexpected Blossoming","$1.99"
"Crafts Hobbies Home",44,"Disney Dreams Collection Thomas Kinkade Studios Coloring Book","$10.38"
